otf9ruvj,5df3884ac512e1ad4cedd33f5e83b09a9cfa5668,PMC,Intravenous immunoglobulin fails to improve ARDS in patients undergoing ECMO therapy,10.1186/s40560-018-0278-8,PMC5827994,29497534,cc-by,"BACKGROUND: Acute respiratory distress syndrome (ARDS) is associated with high mortality rates. ARDS patients suffer from severe hypoxemia, and extracorporeal membrane oxygenation (ECMO) therapy may be necessary to ensure oxygenation. ARDS has various etiologies, including trauma, ischemia-reperfusion injury or infections of various origins, and the associated immunological responses may vary. To support the immunological response in this patient collective, we used intravenous IgM immunoglobulin therapy to enhance the likelihood of pulmonary recovery. METHODS: ARDS patients admitted to the intensive care unit (ICU) who were placed on ECMO and treated with (IVIG group; n = 29) or without (control group; n = 28) intravenous IgM-enriched immunoglobulins for 3 days in the initial stages of ARDS were analyzed retrospectively. RESULTS: The baseline characteristics did not differ between the groups, although the IVIG group showed a significantly reduced oxygenation index compared to the control group. We found no differences in the length of ICU stay or ventilation parameters. We did not find a significant difference between the groups for the extent of inflammation or for overall survival. CONCLUSION: We conclude that administration of IgM-enriched immunoglobulins as an additional therapy did not have a beneficial effect in patients with severe ARDS requiring ECMO support. TRIAL REGISTRATION: Clinical Trials: NCT02961166; retrospectively registered.",2018-02-26,"Prohaska, Stefanie; Schirner, Andrea; Bashota, Albina; Körner, Andreas; Blumenstock, Gunnar; Haeberle, Helene A.",J Intensive Care,,,True,comm_use_subset,https://www.ncbi.nlm.nih.gov/pmc/articles/PMC5827994/
7bgerq3r,aa2ed61346b7c005b96d661476a671b555b2a93a,PMC,Asymptomatic Middle East Respiratory Syndrome coronavirus infection using a serologic survey in Korea,10.4178/epih.e2018014,PMC5968208,29656631,cc-by,"OBJECTIVES: The rates of asymptomatic infection with Middle East Respiratory Syndrome (MERS) coronavirus vary. A serologic study was conducted to determine the asymptomatic MERS infection rate in healthcare workers and non-healthcare workers by exposure status. METHODS: Study participants were selected from contacts of MERS patients based on a priority system in 4 regions strongly affected by the 2015 MERS outbreak. A sero-epidemiological survey was performed in 1,610 contacts (average duration from exposure to test, 4.8 months), and the collected sera were tested using an enzyme-linked immunespecific assay (ELISA), immunofluorescence assay (IFA), and plaque reduction neutralization antibody test (PRNT). Among the 1,610 contacts, there were 7 ELISA-positive cases, of which 1 exhibited positive IFA and PRNT results. RESULTS: The asymptomatic infection rate was 0.060% (95% confidence interval, 0.002 to 0.346). The asymptomatic MERS case was a patient who had been hospitalized with patient zero on the same floor of the hospital at the same time. The case was quarantined at home for 2 weeks after discharge, and had underlying diseases, including hypertension, angina, and degenerative arthritis. CONCLUSIONS: The asymptomatic infection was acquired via healthcare-associated transmission. Thus, it is necessary to extend serologic studies to include inpatient contacts who have no symptoms.",2018-04-15,"Song, Yeong-jun; Yang, Jeong-Sun; Yoon, Hee Jung; Nam, Hae-Sung; Lee, Soon Young; Cheong, Hae-Kwan; Park, Woo-Jung; Park, Sung Han; Choi, Bo Youl; Kim, Sung Soon; Ki, Moran",Epidemiol Health,,,True,comm_use_subset,https://www.ncbi.nlm.nih.gov/pmc/articles/PMC5968208/
88q36g00,d603d8aa5b328d708683d754f224c1f9d170fc64,PMC,Administration of molecular hydrogen during pregnancy improves behavioral abnormalities of offspring in a maternal immune activation model,10.1038/s41598-018-27626-4,PMC6003913,29907804,cc-by,"The aim of the present study was to investigate long-term outcomes of the offspring in a lipopolysaccharide (LPS)-induced maternal immune activation (MIA) model and the effect of maternal molecular hydrogen (H(2)) administration. We have previously demonstrated in the MIA mouse model that maternal administration of H(2) attenuates oxidative damage and neuroinflammation, including induced pro-inflammatory cytokines and microglial activation, in the fetal brain. Short-term memory, sociability and social novelty, and sensorimotor gating were evaluated using the Y-maze, three-chamber, and prepulse inhibition (PPI) tests, respectively, at postnatal 3 or 4 weeks. The number of neurons and oligodendrocytes was also analyzed at postnatal 5 weeks by immunohistochemical analysis. Offspring of the LPS-exposed dams showed deficits in short-term memory and social interaction, following neuronal and oligodendrocytic loss in the amygdala and cortex. Maternal H(2) administration markedly attenuated these LPS-induced abnormalities. Moreover, we evaluated the effect of H(2) on LPS-induced astrocytic activation, both in vivo and in vitro. The number of activated astrocytes with hypertrophic morphology was increased in LPS-exposed offspring, but decreased in the offspring of H(2)-administered dams. In primary cultured astrocytes, LPS-induced pro-inflammatory cytokines were attenuated by H(2) administration. Overall, these findings indicate that maternal H(2) administration exerts neuroprotective effects and ameliorates MIA-induced neurodevelopmental deficits of offspring later in life.",2018-06-15,"Imai, Kenji; Kotani, Tomomi; Tsuda, Hiroyuki; Nakano, Tomoko; Ushida, Takafumi; Iwase, Akira; Nagai, Taku; Toyokuni, Shinya; Suzumura, Akio; Kikkawa, Fumitaka",Sci Rep,,,True,comm_use_subset,https://www.ncbi.nlm.nih.gov/pmc/articles/PMC6003913/
p2h8p5bm,86ba599c91bdbd03345c42fab209766f19f3c5dc,PMC,Tick-Borne Flaviviruses and the Type I Interferon Response,10.3390/v10070340,PMC6071234,29933625,cc-by,"Flaviviruses are globally distributed pathogens causing millions of human infections every year. Flaviviruses are arthropod-borne viruses and are mainly transmitted by either ticks or mosquitoes. Mosquito-borne flaviviruses and their interactions with the innate immune response have been well-studied and reviewed extensively, thus this review will discuss tick-borne flaviviruses and their interactions with the host innate immune response.",2018-06-21,"Lindqvist, Richard; Upadhyay, Arunkumar; Överby, Anna K.",Viruses,,,True,comm_use_subset,https://www.ncbi.nlm.nih.gov/pmc/articles/PMC6071234/
26lvnqaq,9984d00caafab39f1c5673c4f7cc53fbddf0b8e9,PMC,A G1-lineage H9N2 virus with oviduct tropism causes chronic pathological changes in the infundibulum and a long-lasting drop in egg production,10.1186/s13567-018-0575-1,PMC6116506,30157967,cc-by,"Since 1997, G1-lineage H9N2 avian influenza viruses have been circulating in Asia and later on in the Middle East, and they have been associated to mild respiratory disease, drops in egg production and moderate mortality in chickens, in particular in the presence of concurrent infections. In this study, we investigated the importance of the G1-lineage H9N2 A/chicken/Israel/1163/2011 virus as a primary pathogen in layers, analyzing its tropism and binding affinity for the oviduct tissues, and investigating the long-term impact on egg production. Besides causing a mild respiratory infection, the virus replicated in the oviduct of 60% of the hens causing different degrees of salpingitis throughout the organ, in particular at the level of the infundibulum, where the detection of the virus was associated with severe heterophilic infiltrate, and necrosis of the epithelium. Binding affinity assays confirmed that the infundibulum was the most receptive region of the oviduct. The drop in egg production was at its peek at 2 weeks post-infection (pi) (60% decrease) and continued up to 80 days pi (35% decrease). On day 80 pi, non-laying birds showed egg yolk peritonitis, and histopathological analyses described profound alteration of the infundibulum architecture, duct ectasia and thinning of the epithelium, while the rest of the oviduct and ovary appeared normal. Our results show that this H9N2 virus is a primary pathogen in layer hens, and that its replication in the infundibulum is responsible for acute and chronic lesions that limits the effective functionality of the oviduct, compromising the commercial life of birds. ELECTRONIC SUPPLEMENTARY MATERIAL: The online version of this article (10.1186/s13567-018-0575-1) contains supplementary material, which is available to authorized users.",2018-08-29,"Bonfante, Francesco; Mazzetto, Eva; Zanardello, Claudia; Fortin, Andrea; Gobbo, Federica; Maniero, Silvia; Bigolaro, Michela; Davidson, Irit; Haddas, Ruth; Cattoli, Giovanni; Terregino, Calogero",Vet Res,,,True,comm_use_subset,https://www.ncbi.nlm.nih.gov/pmc/articles/PMC6116506/
ie2kk5yi,6b83ccbaff4b9d9f4ac38fcfbbb2bdde5b3c53aa,PMC,"Genetic diversity, infection prevalence, and possible transmission routes of Bartonella spp. in vampire bats",10.1371/journal.pntd.0006786,PMC6159870,30260954,cc-by,"Bartonella spp. are globally distributed bacteria that cause endocarditis in humans and domestic animals. Recent work has suggested bats as zoonotic reservoirs of some human Bartonella infections; however, the ecological and spatiotemporal patterns of infection in bats remain largely unknown. Here we studied the genetic diversity, prevalence of infection across seasons and years, individual risk factors, and possible transmission routes of Bartonella in populations of common vampire bats (Desmodus rotundus) in Peru and Belize, for which high infection prevalence has previously been reported. Phylogenetic analysis of the gltA gene for a subset of PCR-positive blood samples revealed sequences that were related to Bartonella described from vampire bats from Mexico, other Neotropical bat species, and streblid bat flies. Sequences associated with vampire bats clustered significantly by country but commonly spanned Central and South America, implying limited spatial structure. Stable and nonzero Bartonella prevalence between years supported endemic transmission in all sites. The odds of Bartonella infection for individual bats was unrelated to the intensity of bat flies ectoparasitism, but nearly all infected bats were infested, which precluded conclusive assessment of support for vector-borne transmission. While metagenomic sequencing found no strong evidence of Bartonella DNA in pooled bat saliva and fecal samples, we detected PCR positivity in individual saliva and feces, suggesting the potential for bacterial transmission through both direct contact (i.e., biting) and environmental (i.e., fecal) exposures. Further investigating the relative contributions of direct contact, environmental, and vector-borne transmission for bat Bartonella is an important next step to predict infection dynamics within bats and the risks of human and livestock exposures.",2018-09-27,"Becker, Daniel J.; Bergner, Laura M.; Bentz, Alexandra B.; Orton, Richard J.; Altizer, Sonia; Streicker, Daniel G.",PLoS Negl Trop Dis,,,True,comm_use_subset,https://www.ncbi.nlm.nih.gov/pmc/articles/PMC6159870/
6lv3di4x,68ca53b6414e682661c4decd41eb9ff00574d862,PMC,Targeting of the Nasal Mucosa by Japanese Encephalitis Virus for Non-Vector-Borne Transmission,10.1128/jvi.01091-18,PMC6258954,30282716,cc-by,"The mosquito-borne Japanese encephalitis virus (JEV) causes severe central nervous system diseases and cycles between Culex mosquitoes and different vertebrates. For JEV and some other flaviviruses, oronasal transmission is described, but the mode of infection is unknown. Using nasal mucosal tissue explants and primary porcine nasal epithelial cells (NEC) at the air-liquid interface (ALI) and macrophages as ex vivo and in vitro models, we determined that the nasal epithelium could represent the route of entry and exit for JEV in pigs. Porcine NEC at the ALI exposed to with JEV resulted in apical and basolateral virus shedding and release of monocyte recruiting chemokines, indicating infection and replication in macrophages. Moreover, macrophages stimulated by alarmins, including interleukin-25, interleukin-33, and thymic stromal lymphopoietin, were more permissive to the JEV infection. Altogether, our data are important to understand the mechanism of non-vector-borne direct transmission of Japanese encephalitis virus in pigs. IMPORTANCE JEV, a main cause of severe viral encephalitis in humans, has a complex ecology composed of a mosquito-waterbird cycle and a cycle involving pigs, which amplifies virus transmission to mosquitoes, leading to increased human cases. JEV can be transmitted between pigs by contact in the absence of arthropod vectors. Moreover, virus or viral RNA is found in oronasal secretions and the nasal epithelium. Using nasal mucosa tissue explants and three-dimensional porcine nasal epithelial cells cultures and macrophages as ex vivo and in vitro models, we determined that the nasal epithelium could be a route of entry as well as exit for the virus. Infection of nasal epithelial cells resulted in apical and basolateral virus shedding and release of monocyte recruiting chemokines and therefore infection and replication in macrophages, which is favored by epithelial-cell-derived cytokines. The results are relevant to understand the mechanism of non-vector-borne direct transmission of JEV.",2018-11-27,"García-Nicolás, Obdulio; Braun, Roman O.; Milona, Panagiota; Lewandowska, Marta; Dijkman, Ronald; Alves, Marco P.; Summerfield, Artur",J Virol,,,True,comm_use_subset,https://www.ncbi.nlm.nih.gov/pmc/articles/PMC6258954/
1dfzj1b3,c27cd721cc62f4294aeb0159e587efb9391ce8ad,PMC,Antioxidant and Anti-Inflammatory Activities of Essential Oils: A Short Review,10.3390/molecules15129252,PMC6259136,21160452,cc-by,"Essential oils are complex mixtures isolated from aromatic plants which may possess antioxidant and anti-inflammatory activities of interest in thye food and cosmetic industries as well as in the human health field. In this work, a review was done on the most recent publications concerning their antioxidant and anti-inflammatory activities. At the same time a survey of the methods generally used for the evaluation of antioxidant activity and some of the mechanisms involved in the anti-inflammatory activities of essential oils are also reported.",2010-12-15,"Miguel, Maria Graça",Molecules,,,True,comm_use_subset,https://www.ncbi.nlm.nih.gov/pmc/articles/PMC6259136/
htoexg53,9dd88265053594d2736a884a8b972b6ae94218c5,PMC,CD8+ T Cells Responding to the Middle East Respiratory Syndrome Coronavirus Nucleocapsid Protein Delivered by Vaccinia Virus MVA in Mice,10.3390/v10120718,PMC6316859,30558354,cc-by,"Middle East respiratory syndrome coronavirus (MERS-CoV), a novel infectious agent causing severe respiratory disease and death in humans, was first described in 2012. Antibodies directed against the MERS-CoV spike (S) protein are thought to play a major role in controlling MERS-CoV infection and in mediating vaccine-induced protective immunity. In contrast, relatively little is known about the role of T cell responses and the antigenic targets of MERS-CoV that are recognized by CD8+ T cells. In this study, the highly conserved MERS-CoV nucleocapsid (N) protein served as a target immunogen to elicit MERS-CoV-specific cellular immune responses. Modified Vaccinia virus Ankara (MVA), a safety-tested strain of vaccinia virus for preclinical and clinical vaccine research, was used for generating MVA-MERS-N expressing recombinant N protein. Overlapping peptides spanning the whole MERS-CoV N polypeptide were used to identify major histocompatibility complex class I/II-restricted T cell responses in BALB/c mice immunized with MVA-MERS-N. We have identified a H2-d restricted decamer peptide epitope in the MERS-N protein with CD8+ T cell antigenicity. The identification of this epitope, and the availability of the MVA-MERS-N candidate vaccine, will help to evaluate MERS-N-specific immune responses and the potential immune correlates of vaccine-mediated protection in the appropriate murine models of MERS-CoV infection.",2018-12-16,"Veit, Svenja; Jany, Sylvia; Fux, Robert; Sutter, Gerd; Volz, Asisa",Viruses,,,True,comm_use_subset,https://www.ncbi.nlm.nih.gov/pmc/articles/PMC6316859/
yr1zanxx,837abf94f591d8288f0b9faa53055d2724ff783f,PMC,CSF1R antagonism limits local restimulation of antiviral CD8(+) T cells during viral encephalitis,10.1186/s12974-019-1397-4,PMC6354430,30704498,cc-by,"BACKGROUND: Microglia are resident macrophages of the central nervous system (CNS) locally maintained through colony-stimulating factor 1 receptor (CSF1R) signaling. Microglial depletion via CSF1R inactivation improves cognition in mouse models of neuroinflammation, but limits virologic control in the CNS of mouse models of neurotropic infections by unknown mechanisms. We hypothesize that CSF1R plays a critical role in myeloid cell responses that restrict viral replication and locally restimulate recruited antiviral T cells within the CNS. METHODS: The impact of CSF1R signaling during West Nile virus infection was assessed in vivo using a mouse model of neurotropic infection. Pharmacological inactivation of CSF1R was achieved using PLX5622 prior to infection with virulent or attenuated strains of West Nile virus (WNV), an emerging neuropathogen. The subsequent effect of CSF1R antagonism on virologic control was assessed by measuring mortality and viral titers in the CNS and peripheral organs. Immune responses were assessed by flow cytometric-based phenotypic analyses of both peripheral and CNS immune cells. RESULTS: Mice treated with CSF1R antagonist prior to infection exhibited higher susceptibility to lethal WNV infection and lack of virologic control in both the CNS and periphery. CSFR1 antagonism reduced B7 co-stimulatory signals on peripheral and CNS antigen-presenting cells (APCs) by depleting CNS cellular sources, which limited local reactivation of CNS-infiltrating virus-specific T cells and reduced viral clearance. CONCLUSIONS: Our results demonstrate the impact of CSF1R antagonism on APC activation in the CNS and periphery and the importance of microglia in orchestrating the CNS immune response following neurotropic viral infection. These data will be an important consideration when assessing the benefit of CSF1R antagonism, which has been investigated as a therapeutic for neurodegenerative conditions, in which neuroinflammation is a contributing factor. ELECTRONIC SUPPLEMENTARY MATERIAL: The online version of this article (10.1186/s12974-019-1397-4) contains supplementary material, which is available to authorized users.",2019-01-31,"Funk, Kristen E.; Klein, Robyn S.",J Neuroinflammation,,,True,comm_use_subset,https://www.ncbi.nlm.nih.gov/pmc/articles/PMC6354430/
m6pur6td,5811a8c7d5d59061c11b2084dca1e307c49867b7,PMC,"Features and drivers for energy-related carbon emissions in mega city: The case of Guangzhou, China based on an extended LMDI model",10.1371/journal.pone.0210430,PMC6370191,30742627,cc-by,"Based on the apparent energy consumption data, a systematic and comprehensive city-level total carbon accounting approach was established and applied in Guangzhou, China. A newly extended LMDI method based on the Kaya identity was adopted to examine the main drivers for the carbon emissions increments both at the industrial sector and the residential sector. Research results are listed as follow: (1) Carbon emissions embodied in the imported electricity played a significant important role in emissions mitigation in Guangzhou. (2) The influences and impacts of various driving factors on industrial and residential carbon emissions are different in the three different development periods, namely, the 10(th) five-year plan period (2003–2005), the 11(th) five-year plan period (2005–2010), and the 12(th) five-year plan period (2010–2013). The main reasons underlying these influencing mechanisms were different policy measures announced by the central and local government during the different five-year plan periods. (3) The affluence effect (g-effect) was the dominant positive effect in driving emissions increase, while the energy intensity effect of production (e-effect-Production), the economic structure effect (s-effect) and the carbon intensity effect of production (f-effect-Production) were the main contributing factors suppressing emissions growth at the industrial sector. (4) The affluence effect of urban (g-effect-AUI) was the most dominant positive driving factor on emissions increment, while the energy intensity effect of urban (e-effect-Urban) played the most important role in curbing emissions growth at the residential sector.",2019-02-11,"Wang, Changjian; Wu, Kangmin; Zhang, Xinlin; Wang, Fei; Zhang, Hongou; Ye, Yuyao; Wu, Qitao; Huang, Gengzhi; Wang, Yang; Wen, Bin",PLoS One,,,True,comm_use_subset,https://www.ncbi.nlm.nih.gov/pmc/articles/PMC6370191/
1bi6q127,3e5e8609bc2b23b770b037ee006b028a17f4a121,PMC,Immune System Modulation and Viral Persistence in Bats: Understanding Viral Spillover,10.3390/v11020192,PMC6410205,30813403,cc-by,Bats harbor a myriad of viruses and some of these viruses may have spilled over to other species including humans. Spillover events are rare and several factors must align to create the “perfect storm” that would ultimately lead to a spillover. One of these factors is the increased shedding of virus by bats. Several studies have indicated that bats have unique defense mechanisms that allow them to be persistently or latently infected with viruses. Factors leading to an increase in the viral load of persistently infected bats would facilitate shedding of virus. This article reviews the unique nature of bat immune defenses that regulate virus replication and the various molecular mechanisms that play a role in altering the balanced bat–virus relationship.,2019-02-23,"Subudhi, Sonu; Rapin, Noreen; Misra, Vikram",Viruses,,,True,comm_use_subset,https://www.ncbi.nlm.nih.gov/pmc/articles/PMC6410205/
1wjhsg2y,a6d2693a3c3bc48b290f231e8824be62c8f364ff,PMC,Bat Research Networks and Viral Surveillance: Gaps and Opportunities in Western Asia,10.3390/v11030240,PMC6466127,30857374,cc-by,"Bat research networks and viral surveillance are assumed to be at odds due to seemingly conflicting research priorities. Yet human threats that contribute to declines in bat populations globally also lead to increased transmission and spread of bat-associated viruses, which may pose a threat to global health and food security. In this review, we discuss the importance of and opportunities for multidisciplinary collaborations between bat research networks and infectious disease experts to tackle shared threats that jeopardize bat conservation as well as human and animal health. Moreover, we assess research effort on bats and bat-associated viruses globally, and demonstrate that Western Asia has limited published research and represents a gap for coordinated bat research. The lack of bat research in Western Asia severely limits our capacity to identify and mitigate region-specific threats to bat populations and detect interactions between bats and incidental hosts that promote virus spillover. We detail a regional initiative to establish the first bat research network in Western Asia (i.e., the Western Asia Bat Research Network, WAB-Net), with the aim of integrating ecological research on bats with virus surveillance to find “win-win” solutions that promote bat conservation and safeguard public and animal health across the region.",2019-03-10,"Phelps, Kendra L.; Hamel, Luke; Alhmoud, Nisreen; Ali, Shahzad; Bilgin, Rasit; Sidamonidze, Ketevan; Urushadze, Lela; Karesh, William; Olival, Kevin J.",Viruses,,,True,comm_use_subset,https://www.ncbi.nlm.nih.gov/pmc/articles/PMC6466127/
6i7b1i5x,0969d53ac7a447d43b431dbe9744e416de26df38,PMC,B Cells and Antibodies in Kawasaki Disease,10.3390/ijms20081834,PMC6514959,31013925,cc-by,"The etiology of Kawasaki disease (KD), the leading cause of acquired heart disease in children, is currently unknown. Epidemiology supports a relationship of KD to an infectious disease. Several pathological mechanisms are being considered, including a superantigen response, direct invasion by an infectious etiology or an autoimmune phenomenon. Treating affected patients with intravenous immunoglobulin is effective at reducing the rates of coronary aneurysms. However, the role of B cells and antibodies in KD pathogenesis remains unclear. Murine models are not clear on the role for B cells and antibodies in pathogenesis. Studies on rare aneurysm specimens reveal plasma cell infiltrates. Antibodies generated from these aneurysmal plasma cell infiltrates showed cross-reaction to intracellular inclusions in the bronchial epithelium of a number of pathologic specimens from children with KD. These antibodies have not defined an etiology. Notably, a number of autoantibody responses have been reported in children with KD. Recent studies show acute B cell responses are similar in children with KD compared to children with infections, lending further support of an infectious disease cause of KD. Here, we will review and discuss the inconsistencies in the literature in relation to B cell responses, specific antibodies, and a potential role for humoral immunity in KD pathogenesis or diagnosis.",2019-04-13,"Lindquist, Michael E.; Hicar, Mark D.",Int J Mol Sci,,,True,comm_use_subset,https://www.ncbi.nlm.nih.gov/pmc/articles/PMC6514959/
