x0wij3gt,37e2ecefeffdf8d95f1509809b59fe0464abba44,PMC,"Prostaglandin E(2) stimulates normal bronchial epithelial cell growth through induction of c-Jun and PDK1, a kinase implicated in oncogenesis",10.1186/s12931-015-0309-0,PMC4699375,26684827,cc-by,"BACKGROUND: Cyclooxygenase-2-derived prostaglandin E(2) (PGE(2)), a bioactive eicosanoid, has been implicated in many biological processes including reproduction, inflammation and tumor growth. We previously showed that PGE(2) stimulated lung cancer cell growth and progression through PGE(2) receptor EP2/EP4-mediated kinase signaling pathways. However, the role of PGE(2) in controlling lung airway epithelial cell phenotype remains unknown. We evaluated the effects of c-Jun and 3-phosphoinositede dependent protein kinase-1 (PDK1) in mediating epithelial cell hyperplasia induced by PGE(2). METHOD: The bronchial epithelial cell lines BEAS-2B and HBEc14-KT were cultured and then treated with PGE(2). PDK1 small interfering RNA (siRNA) and a PDK1 inhibitor, an antagonist of the PGE(2) receptor subtype EP4 and EP4 siRNA, c-Jun siRNA, and overexpressions of c-Jun and PDK1 have been used to evaluate the effects on cell proliferation. RESULTS: We demonstrated that PGE(2) increased normal bronchial epithelial cell proliferation through induction of PDK1, an ankyrin repeat-containing Ser/Thr kinase implicated in the induction of apoptosis and the suppression of tumor growth. PDK1 siRNA and a PDK1 inhibitor blocked the effects of PGE(2) on normal cell growth. The PGE(2)-induced PDK1 expression was blocked by an antagonist of the PGE(2) receptor subtype EP4 and by EP4 siRNA. In addition, we showed that induction of PDK1 by PGE(2) was associated with induction of the transcription factor, c-Jun protein. Silencing of c-Jun using siRNA and point mutations of c-Jun sites in the PDK1 gene promoter resulted in blockade of PDK1 expression and promoter activity induced by PGE(2). In contrast, overexpression of c-Jun induced PDK1 gene promoter activity and expression followed increased cell proliferation. CONCLUSION: PGE(2) increases normal bronchial epithelial cell proliferation through increased PDK1 gene expression that is dependent on EP4 and induction of c-Jun. Therewith, our data suggest a new role of c-Jun and PDK1 in mediating epithelial cell hyperplasia induced by PGE(2).",2015-12-18,"Fan, Yu; Wang, Ye; Wang, Ke",Respir Res,,,True,comm_use_subset,https://www.ncbi.nlm.nih.gov/pmc/articles/PMC4699375/
54lx7cl3,db7ddc7b6e1689aed55b17716e2c2d3309b56f90,PMC,The role of respiratory viruses in the etiology of bacterial pneumonia: An ecological perspective,10.1093/emph/eow007,PMC4801059,26884414,cc-by,"Pneumonia is the leading cause of death among children less than 5 years old worldwide. A wide range of viral, bacterial and fungal agents can cause pneumonia: although viruses are the most common etiologic agent, the severity of clinical symptoms associated with bacterial pneumonia and increasing antibiotic resistance makes bacterial pneumonia a major public health concern. Bacterial pneumonia can follow upper respiratory viral infection and complicate lower respiratory viral infection. Secondary bacterial pneumonia is a major cause of influenza-related deaths. In this review, we evaluate the following hypotheses: (i) respiratory viruses influence the etiology of pneumonia by altering bacterial community structure in the upper respiratory tract (URT) and (ii) respiratory viruses promote or inhibit colonization of the lower respiratory tract (LRT) by certain bacterial species residing in the URT. We conducted a systematic review of the literature to examine temporal associations between respiratory viruses and bacteria and a targeted review to identify potential mechanisms of interactions. We conclude that viruses both alter the bacterial community in the URT and promote bacterial colonization of the LRT. However, it is uncertain whether changes in the URT bacterial community play a substantial role in pneumonia etiology. The exception is Streptococcus pneumoniae where a strong link between viral co-infection, increased carriage and pneumococcal pneumonia has been established.",2016-02-15,"Lee, Kyu Han; Gordon, Aubree; Foxman, Betsy",Evol Med Public Health,,,True,comm_use_subset,https://www.ncbi.nlm.nih.gov/pmc/articles/PMC4801059/
c0w9bw5u,aa973f2833829b97ebdfd6ce2ac6a29b9100db3a,PMC,Middle East respiratory syndrome coronavirus M protein suppresses type I interferon expression through the inhibition of TBK1-dependent phosphorylation of IRF3,10.1038/emi.2016.33,PMC4855074,27094905,cc-by,"Middle East respiratory syndrome coronavirus (MERS-CoV) infection has claimed hundreds of lives and has become a global threat since its emergence in Saudi Arabia in 2012. The ability of MERS-CoV to evade the host innate antiviral response may contribute to its severe pathogenesis. Many MERS-CoV-encoded proteins were identified to have interferon (IFN)-antagonizing properties, which correlates well with the reduced IFN levels observed in infected patients and ex vivo models. In this study, we fully characterized the IFN-antagonizing property of the MERS-CoV M protein. Expression of MERS-CoV M protein suppressed type I IFN expression in response to Sendai virus infection or poly(I:C) induction. This suppressive effect was found to be specific for the activation of IFN regulatory factor 3 (IRF3) but not nuclear factor-κB. MERS-CoV M protein interacted with TRAF3 and disrupted TRAF3–TBK1 association leading to reduced IRF3 activation. M proteins from MERS-CoV and SARS-CoV have three highly similar conserved N-terminal transmembrane domains and a C-terminal region. Using chimeric and truncation mutants, the N-terminal transmembrane domains of the MERS-CoV M protein were found to be sufficient for its inhibitory effect on IFN expression, whereas the C-terminal domain was unable to induce this suppression. Collectively, our findings suggest a common and conserved mechanism through which highly pathogenic MERS-CoV and SARS-CoV harness their M proteins to suppress type I IFN expression at the level of TBK1-dependent phosphorylation and activation of IRF3 resulting in evasion of the host innate antiviral response.",2016-04-20,"Lui, Pak-Yin; Wong, Lok-Yin Roy; Fung, Cheuk-Lai; Siu, Kam-Leung; Yeung, Man-Lung; Yuen, Kit-San; Chan, Chi-Ping; Woo, Patrick Chiu-Yat; Yuen, Kwok-Yung; Jin, Dong-Yan",Emerg Microbes Infect,,,True,comm_use_subset,https://www.ncbi.nlm.nih.gov/pmc/articles/PMC4855074/
b78pccz5,f9e8af068e552f4327e0e7cdd359674967d9d422; c5375b07f72048d739efc376420a5cb5374392d6,PMC,Reducing burden of disease from residential indoor air exposures in Europe (HEALTHVENT project),10.1186/s12940-016-0101-8,PMC4895703,26961383,cc-by,"BACKGROUND: The annual burden of disease caused indoor air pollution, including polluted outdoor air used to ventilate indoor spaces, is estimated to correspond to a loss of over 2 million healthy life years in the European Union (EU). Based on measurements of the European Environment Agency (EEA), approximately 90 % of EU citizens live in areas where the World Health Organization (WHO) guidelines for air quality of particulate matter sized < 2.5 mm (PM(2.5)) are not met. Since sources of pollution reside in both indoor and outdoor air, selecting the most appropriate ventilation strategy is not a simple and straightforward task. METHODS: A framework for developing European health-based ventilation guidelines was created in 2010–2013 in the EU-funded HEALTHVENT project. As a part of the project, the potential efficiency of control policies to health effects caused by residential indoor exposures of fine particulate matter (PM(2.5)), outdoor bioaerosols, volatile organic compounds (VOC), carbon oxide (CO) radon and dampness was estimated. The analysis was based on scenario comparison, using an outdoor-indoor mass-balance model and varying the ventilation rates. Health effects were estimated with burden of diseases (BoD) calculations taking into account asthma, cardiovascular (CV) diseases, acute toxication, respiratory infections, lung cancer and chronic obstructive pulmonary disease (COPD). RESULTS: The quantitative comparison of three main policy approaches, (i) optimising ventilation rates only; (ii) filtration of outdoor air; and (iii) indoor source control, showed that all three approaches are able to provide substantial reductions in the health risks, varying from approximately 20 % to 44 %, corresponding to 400 000 and 900 000 saved healthy life years in EU-26. PM(2.5) caused majority of the health effects in all included countries, but the importance of the other pollutants varied by country. CONCLUSIONS: The present modelling shows, that combination of controlling the indoor air sources and selecting appropriate ventilation rate was the most effective to reduce health risks. If indoor sources cannot be removed or their emissions cannot be limited to an accepted level, ventilation needs to be increased to remove remaining pollutants. In these cases filtration of outdoor air may be needed to prevent increase of health risks. ELECTRONIC SUPPLEMENTARY MATERIAL: The online version of this article (doi:10.1186/s12940-016-0101-8) contains supplementary material, which is available to authorized users.",2016-03-08,"Asikainen, Arja; Carrer, Paolo; Kephalopoulos, Stylianos; Fernandes, Eduardo de Oliveira; Wargocki, Pawel; Hänninen, Otto",Environ Health,,,True,comm_use_subset,https://www.ncbi.nlm.nih.gov/pmc/articles/PMC4895703/
fqna8ffg,c8d2fa6e178d17b218df59b33cfcb5839af7dc7f; 34c60b33c493dfe1545112d9f4b1107576f11dbd,PMC,No involvement of alveolar macrophages in the initiation of carbon nanoparticle induced acute lung inflammation in mice,10.1186/s12989-016-0144-6,PMC4915176,27328634,cc-by,"BACKGROUND: Carbonaceous nanoparticles (CNP) represent a major constituent of urban particulate air pollution, and inhalation of high CNP levels has been described to trigger a pro-inflammatory response of the lung. While several studies identified specific particle characteristics driving respiratory toxicity of low-solubility and low-toxicity particles such as CNP, the major lung cell type, which initiates and drives that response, remains still uncertain. Since alveolar macrophages (AM) are known to effectively phagocytose inhaled particles and play a crucial role for the initiation of pulmonary inflammation caused by invading microbes, we aimed to determine their role for sterile stimuli such as CNP by profiling the primary alveolar cell compartments of the lung. We exposed C57BL/6 mice to 20 μg CNP by intratracheal instillation and comprehensively investigated the expression of the underlying mediators during a time span of 3 to 72 h in three different lung cell populations: CD45- (negative) structural cells, CD45+ (positive) leukocytes, and by BAL recovered cells. RESULTS: Bronchoalveolar lavage (BAL) analysis revealed an acute inflammatory response characterized by the most prominent culmination of neutrophil granulocytes from 12 to 24 h after instillation, which declined to basal levels by day 7. As early as 3 h after CNP exposure 50 % of the AM revealed particle laden. BAL concentrations and lung gene expression profiles of TNFα, and the neutrophil chemoattractants CXCL1,-2 and-5 preceded the neutrophil recruitment and showed highest levels after 12 h of CNP exposure, pointing to a significant activation of the inflammation-evoking lung cells at this point of time. AM, isolated from lungs 3 to 12 h after CNP instillation, however, did not show a pro-inflammatory signature. On the contrary, gene expression analysis of different lung cell populations isolated 12 h after CNP instillation revealed CD45-, mainly representing alveolar epithelial type II (ATII) cells as major producer of inflammatory CXCL cytokines. Particularly by CD45- cells expressed Cxcl5 proved to be the most abundant chemokine, being 12 h after CNP exposure 24 (±11) fold induced. CONCLUSION: Our data suggests that AM are noninvolved in the initiation of the inflammatory response. ATII cells, which induced highest CXCL levels early on, might in contrast be the driver of acute neutrophilic inflammation upon pulmonary CNP exposure. ELECTRONIC SUPPLEMENTARY MATERIAL: The online version of this article (doi:10.1186/s12989-016-0144-6) contains supplementary material, which is available to authorized users.",2016-06-21,"Chen, Shanze; Yin, Renfu; Mutze, Kathrin; Yu, Youjia; Takenaka, Shinji; Königshoff, Melanie; Stoeger, Tobias",Part Fibre Toxicol,,,True,comm_use_subset,https://www.ncbi.nlm.nih.gov/pmc/articles/PMC4915176/
rdgm0q7m,dcd1759241f327b5235520cebe1f7432aa936c5d; 6fb5ec70b6d25243856c076c05809c2ed9d49bf1,PMC,A novel role for poly(C) binding proteins in programmed ribosomal frameshifting,10.1093/nar/gkw480,PMC4937337,27257056,cc-by,"Translational control through programmed ribosomal frameshifting (PRF) is exploited widely by viruses and increasingly documented in cellular genes. Frameshifting is induced by mRNA secondary structures that compromise ribosome fidelity during decoding of a heptanucleotide ‘slippery’ sequence. The nsp2 PRF signal of porcine reproductive and respiratory syndrome virus is distinctive in directing both −2 and −1 PRF and in its requirement for a trans-acting protein factor, the viral replicase subunit nsp1β. Here we show that the the trans-activation of frameshifting is carried out by a protein complex composed of nsp1β and a cellular poly(C) binding protein (PCBP). From the results of in vitro translation and electrophoretic mobility shift assays, we demonstrate that a PCBP/nsp1β complex binds to a C-rich sequence downstream of the slippery sequence and here mimics the activity of a structured mRNA stimulator of PRF. This is the first description of a role for a trans-acting cellular protein in PRF. The discovery broadens the repertoire of activities associated with poly(C) binding proteins and prototypes a new class of virus–host interactions.",2016-07-08,"Napthine, Sawsan; Treffers, Emmely E.; Bell, Susanne; Goodfellow, Ian; Fang, Ying; Firth, Andrew E.; Snijder, Eric J.; Brierley, Ian",Nucleic Acids Res,,,True,comm_use_subset,https://www.ncbi.nlm.nih.gov/pmc/articles/PMC4937337/
d1m2wv8r,a51659a324f74a7cf16acd3b1180d203cab2b8d4,PMC,Profiling of Host Cell Response to Successive Canine Parvovirus Infection Based on Kinetic Proteomic Change Identification,10.1038/srep29560,PMC4942776,27406444,cc-by,"Canine parvovirus (CPV) reproduces by co-opting the resources of host cells, inevitably causing cytotoxic effects to the host cells. Feline kidney F81 cells are sensitive to CPV infection and show disparate growing statuses at different time points post-infection. This study analysed the response of F81 cells to CPV infection at successive infection time points by iTRAQ-based quantitative proteomics. Differentially expressed proteins (DEPs) during 60 h of infection and at selected time points post-infection were identified by an analysis of variance test and a two-tailed unpaired t test, respectively. DEPs with similar quantitative changes were clustered by hierarchical clustering and analysed by gene ontology enrichment, revealing that 12 h and 60 h post-infection were the optimal times to analyse the autonomous parvovirus replication and apoptosis processes, respectively. Using the Metacore(TM) database, 29 DEPs were enriched in a network involved in p53 regulation. Besides, a significantly enriched pathway suggests that the CPV-induced cytopathic effect was probably due to the deficiency of functional CFTR caused by CPV infection. This study uncovered the systemic changes in key cellular factors involved in CPV infection and help to understand the molecular mechanisms of the anti-cancer activity of CPV and the cytopathic effects induced by CPV infection.",2016-07-13,"Zhao, Hang; Cheng, Yuening; Wang, Jianke; Lin, Peng; Yi, Li; Sun, Yaru; Ren, Jingqiang; Tong, Mingwei; Cao, Zhigang; Li, Jiawei; Deng, Jinliang; Cheng, Shipeng",Sci Rep,,,True,comm_use_subset,https://www.ncbi.nlm.nih.gov/pmc/articles/PMC4942776/
o3sjailf,7c53b0536ccc6dd11ad7de4f55c0baa934f38763,PMC,Astrovirus VA1 identified by next-generation sequencing in a nasopharyngeal specimen of a febrile Tanzanian child with acute respiratory disease of unknown etiology,10.1038/emi.2016.67,PMC4972905,27381218,cc-by,,2016-07-06,"Cordey, Samuel; Brito, Francisco; Vu, Diem-Lan; Turin, Lara; Kilowoko, Mary; Kyungu, Esther; Genton, Blaise; Zdobnov, Evgeny M; D'Acremont, Valérie; Kaiser, Laurent",Emerg Microbes Infect,,,True,comm_use_subset,https://www.ncbi.nlm.nih.gov/pmc/articles/PMC4972905/
sb3ccvsk,376ac2d5c7446918fdc12ef89696687b8a2b23d8,PMC,Differential Regulation of Self-reactive CD4(+) T Cells in Cervical Lymph Nodes and Central Nervous System during Viral Encephalomyelitis,10.3389/fimmu.2016.00370,PMC5030268,27708643,cc-by,"Viral infections have long been implicated as triggers of autoimmune diseases, including multiple sclerosis (MS), a central nervous system (CNS) inflammatory demyelinating disorder. Epitope spreading, molecular mimicry, cryptic antigen, and bystander activation have been implicated as mechanisms responsible for activating self-reactive (SR) immune cells, ultimately leading to organ-specific autoimmune disease. Taking advantage of coronavirus JHM strain of mouse hepatitis virus (JHMV)-induced demyelination, this study demonstrates that the host also mounts counteractive measures to specifically limit expansion of endogenous SR T cells. In this model, immune-mediated demyelination is associated with induction of SR T cells after viral control. However, their decline during persisting infection, despite ongoing demyelination, suggests an active control mechanism. Antigen-specific IL-10-secreting CD4(+) T cells (Tr1) and Foxp3(+) regulatory T cells (Tregs), both known to control autoimmunity and induced following JHMV infection, were assessed for their relative in vivo suppressive function of SR T cells. Ablation of Foxp3(+) Tregs in chronically infected DEREG mice significantly increased SR CD4(+) T cells within cervical lymph nodes (CLN), albeit without affecting their numbers or activation within the CNS compared to controls. In contrast, infected IL-27 receptor deficient (IL-27R(−/−)) mice, characterized by a drastic reduction of Tr1 cells, revealed that SR CD4(+) T cells in CLN remained unchanged but were specifically increased within the CNS. These results suggest that distinct Treg subsets limit SR T cells in the draining lymph nodes and CNS to maximize suppression of SR T-cell-mediated autoimmune pathology. The JHMV model is thus valuable to decipher tissue-specific mechanisms preventing autoimmunity.",2016-09-21,"Savarin, Carine; Bergmann, Cornelia C.; Hinton, David R.; Stohlman, Stephen A.",Front Immunol,,,True,comm_use_subset,https://www.ncbi.nlm.nih.gov/pmc/articles/PMC5030268/
0oq4kkn5,9c1c6037784f97a987e79a92077dad0d252b7236; 4146f749b0883891603380e62be449df9a94a1a3,PMC,Irreversible inhibitors of the 3C protease of Coxsackie virus through templated assembly of protein-binding fragments,10.1038/ncomms12761,PMC5052702,27677239,cc-by,"Small-molecule fragments binding to biomacromolecules can be starting points for the development of drugs, but are often difficult to detect due to low affinities. Here we present a strategy that identifies protein-binding fragments through their potential to induce the target-guided formation of covalently bound, irreversible enzyme inhibitors. A protein-binding nucleophile reacts reversibly with a bis-electrophilic warhead, thereby positioning the second electrophile in close proximity of the active site of a viral protease, resulting in the covalent de-activation of the enzyme. The concept is implemented for Coxsackie virus B3 3C protease, a pharmacological target against enteroviral infections. Using an aldehyde-epoxide as bis-electrophile, active fragment combinations are validated through measuring the protein inactivation rate and by detecting covalent protein modification in mass spectrometry. The structure of one enzyme–inhibitor complex is determined by X-ray crystallography. The presented warhead activation assay provides potent non-peptidic, broad-spectrum inhibitors of enteroviral proteases.",2016-09-28,"Becker, Daniel; Kaczmarska, Zuzanna; Arkona, Christoph; Schulz, Robert; Tauber, Carolin; Wolber, Gerhard; Hilgenfeld, Rolf; Coll, Miquel; Rademann, Jörg",Nat Commun,,,True,comm_use_subset,https://www.ncbi.nlm.nih.gov/pmc/articles/PMC5052702/
0nm7wgf5,4bf5ba8fe5af1bf36c9f2f3af74541fbda3a2c89; 5d445fbd8aa18aca2c2f7c947b25ddd62533f96b,PMC,"N-Desmethylclozapine, Fluoxetine, and Salmeterol Inhibit Postentry Stages of the Dengue Virus Life Cycle",10.1128/aac.01367-16,PMC5075077,27572397,cc-by,"Around 10,000 people die each year due to severe dengue disease, and two-thirds of the world population lives in a region where dengue disease is endemic. There has been remarkable progress in dengue virus vaccine development; however, there are no licensed antivirals for dengue disease, and none appear to be in clinical trials. We took the approach of repositioning approved drugs for anti-dengue virus activity by screening a library of pharmacologically active compounds. We identified N-desmethylclozapine, fluoxetine hydrochloride, and salmeterol xinafoate as dengue virus inhibitors based on reductions in the numbers of infected cells and viral titers. Dengue virus RNA levels were diminished in inhibitor-treated cells, and this effect was specific to dengue virus, as other flaviviruses, such as Japanese encephalitis virus and West Nile virus, or other RNA viruses, such as respiratory syncytial virus and rotavirus, were not affected by these inhibitors. All three inhibitors specifically inhibited dengue virus replication with 50% inhibitory concentrations (IC(50)s) in the high-nanomolar range. Estimation of negative-strand RNA intermediates and time-of-addition experiments indicated that inhibition was occurring at a postentry stage, most probably at the initiation of viral RNA replication. Finally, we show that inhibition is most likely due to the modulation of the endolysosomal pathway and induction of autophagy.",2016-10-21,"Medigeshi, Guruprasad R.; Kumar, Rinki; Dhamija, Ekta; Agrawal, Tanvi; Kar, Meenakshi",Antimicrob Agents Chemother,,,True,comm_use_subset,https://www.ncbi.nlm.nih.gov/pmc/articles/PMC5075077/
21iw0bej,57b4aa7990ee59eb32397dc0dbb4af096a4e9aa8,PMC,Human Enterovirus 68 Interferes with the Host Cell Cycle to Facilitate Viral Production,10.3389/fcimb.2017.00029,PMC5296350,28229049,cc-by,"Enterovirus D68 (EV-D68) is an emerging pathogen that recently caused a large outbreak of severe respiratory disease in the United States and other countries. Little is known about the relationship between EV-D68 virus and host cells. In this study, we assessed the effect of the host cell cycle on EV-D68 viral production, as well as the ability of EV-D68 to manipulate host cell cycle progression. The results suggest that synchronization in G0/G1 phase, but not S phase, promotes viral production, while synchronization in G2/M inhibits viral production. Both an early EV-D68 isolate and currently circulating strains of EV-D68 can manipulate the host cell cycle to arrest cells in the G0/G1 phase, thus providing favorable conditions for virus production. Cell cycle regulation by EV-D68 was associated with corresponding effects on the expression of cyclins and CDKs, which were observed at the level of the protein and/or mRNA. Furthermore, the viral non-structural protein 3D of EV-D68 prevents progression from G0/G1 to S. Interestingly, another member of the Picornaviridae family, EV-A71, differs from EV-D68 in that G0/G1 synchronization inhibits, rather than promotes, EV-A71 viral replication. However, these viruses are similar in that G2/M synchronization inhibits the production and activity of both viruses, which is suggestive of a common therapeutic target for both types of enterovirus. These results further clarify the pathogenic mechanisms of enteroviruses and provide a potential strategy for the treatment and prevention of EV-D68-related disease.",2017-02-08,"Wang, Zeng-yan; Zhong, Ting; Wang, Yue; Song, Feng-mei; Yu, Xiao-feng; Xing, Li-ping; Zhang, Wen-yan; Yu, Jing-hua; Hua, Shu-cheng; Yu, Xiao-fang",Front Cell Infect Microbiol,,,True,comm_use_subset,https://www.ncbi.nlm.nih.gov/pmc/articles/PMC5296350/
